Source,Section,Title,Date,URL,Text
indiatimes.com,city,Chennai collector warns of action against vendors who pack food in newspapers,14-08-2019,https://timesofindia.indiatimes.com/city/chennai/chennai-collector-warns-of-action-against-vendors-who-pack-food-in-newspapers/articleshow/70676760.cms,"According to a release from the collectorate, eatables like vada, bonda, pakoda and bhaji when packed in newspapers and plastic covers become toxic and should not be consumed. CHENNAI: Chennai district collector R Seethalakshmi on Wednesday warned of action against vendors who store, distribute and sell food packed in printed newspaper, plastic bags and sheets sealed with stapler pins.The sale of food packed in printed newspapers or any inked papers, plastic wraps and bags are not permitted by the Food Safety Act 2006 and the Food Safety and Standards (Licensing and Registration of Food Businesses) Regulation, 2011 as they can cause serious health issues due to chemical and microbiological contamination.“Action will be taken against vendors violating the rules,” Seethalakhsmi said.Earlier, the health department and food safety officials had issued notices prohibiting the sale of food wrapped in newspapers and plastic bags. They had advised vendors to use stainless steel, fresh or dry leaves to store food. Yet, many vendors violated the rule.According to a release from the collectorate, eatables like vada, bonda, pakoda and bhaji when packed in newspapers and plastic covers become toxic and should not be consumed. The Food Safety and Standards Authority of India (FSSAI) had said the printing ink contains cancer-causing agents.Recycled newsprints contain phthalate and mineral oil that should not be mixed with food. They also contain lead and cadmium. Once warm food is placed under newspaper, the printed ink melts and exposes the human body to various health problems, according to the release."
indiatimes.com,city,"Chennai: Action against shops selling food wrapped in plastic, newspaper",15-08-2019,https://timesofindia.indiatimes.com/city/chennai/chennai-action-against-shops-selling-food-wrapped-in-plastic-newspaper/articleshow/70684691.cms,"Picture used for representational purpose only Haryana Jammu & Kashmir Haryana Alliance View i Party View Seats: 90 Results Majority: 46 BJP 48 CONG 37 INLD 2 AAP 0 OTH 3 Jammu & Kashmir Alliance View i Party View Seats: 90 Results Majority: 46 JKNC 42 BJP 29 CONG 6 PDP 3 OTH 10 Source: PValue CHENNAI: The government will take action against vendors who store, distribute and sell food packed in newspaper , plastic bags or sheets sealed with stapler pins, Chennai collector R Seethalakshmi said on Wednesday.The sale of food packed in newspapers or any inked papers, plastic wraps and bags are not permitted by the Food Safety Act 2006 and the Food Safety and Standards (Licensing and Registration of Food Businesses) Regulation, 2011 as they can cause serious health issues due to chemical and microbiological contamination.Earlier, health department and food safety officials issued notices prohibiting sale of food wrapped in newspapers and plastic. They advised vendors to use stainless steel containers, fresh or dry leaves to store food. Yet, many vendors violated the rules.The collector said eatables such as vada, bonda, pakoda and bajji when packed in newspapers and plastic covers become toxic and should not be consumed.The Food Safety and Standards Authority of India (FSSAI) had said printing ink contains cancer-causing agents.Recycled newsprints contain phthalate and mineral oil that should not be mixed with food. It also contains lead and cadmium. Once warm food is placed under newspaper, the printed ink melts and exposes the human body to various health problems, the collector said."
hindustantimes.com,cities,FSDA finds anomalies at Amrit stores on KGMU campus,14-08-2019,https://www.hindustantimes.com/cities/fsda-finds-anomalies-at-amrit-stores-on-kgmu-campus/story-Yi6FxgOKY7xEfZQKhV9vkN.html,
indiatimes.com,topic,"Gibraltar: Latest News, Videos and Photos of Gibraltar",16-08-2019,https://timesofindia.indiatimes.com/topic/Gibraltar,"Solar Eclipse on August 2: Will it be visible in India? Full list of cities etimes.in / Jul 19, 2025, 14:58 (IST) On August 2, 2027, a remarkable solar eclipse, dubbed the ""Great North African Eclipse,"" will occur, lasting nearly six minutes. The path of totality will traverse parts of Europe, Africa, and the Middle East, bringing total darkness to cities within Morocco, Egypt and Saudi Arabia. While India won't experience totality, a partial eclipse will be visible."
indiatimes.com,city,"Tamil Nadu: Ghee, butter as prasad in temples could be ‘inedible’",17-08-2019,https://timesofindia.indiatimes.com/city/chennai/tamil-nadu-ghee-butter-as-prasad-in-temples-could-be-inedible/articleshow/70709111.cms,"Picture used for representational purpose only CHENNAI: The butter given as ‘prasad’ after prayers at temples may contain cancercausing dyes , mustard oil and vanaspati, say food safety officials.Worse, some brands of edible ghee risk contamination as they are made on the same production line churning out ‘inedible’ ghee.Ahead of Krishna Jayanthi, officials on Friday raided more than nine houses in T Nagar that manufacture and sell ‘inedible’ ghee and butter under various names including Vishnu lighting ghee, Sri Krishna deepa ghee, Sri Eshwari ghee and Krishna butter at ₹200 a kg compared to ₹435 per kg of edible ghee by brands such as Aavin.More than 4,000 tonnes of this ghee and butter is sold to various shops every week besides being supplied to temples, officials estimate.“The labels clearly mention they are not edible. But we found that people who don’t see the labels eat this butter after it is offered to the god at various temples,” said Chennai food safety officer A Ramakrishnan.Most manufacturers also make edible ghee and butter on the same assembly line. “This is a complete violation of food safety as there is risk of edible food getting mixed with these chemicals,” another official said. Samples of ghee and butter products were seized from these units and sent for analysis.“We will be able to find adulterants they use. We can frame charges against the manufacturers if edible ghee is contaminated and if there are labelling issues,” he said. If the charges are proved, it can lead to cancellation of manufacturing licence besides criminal action.None of the manufacturers reared cows or had dairy farms and bought raw material — white and yellow butter and ghee — from a distributor (name withheld for investigation) in tins. The distributor also gives them 5 litres of a red dye mixed with mustard oil. This goes into ‘white’ butter to give it the colour and texture of cow’s ghee.The chemicals have also been sent for analysis. Last year, food safety officials in Visakhapatnam found manufacturers mixing synthetic resin adhesive such as Fevicol with ghee.Consuming ghee or butter mixed with colouring chemicals and vanaspathi is dangerous. While the chemicals can cause digestive disorders and cancer, the effect of vanaspathi is equally devastating.“It is vegetable ghee that has been hydrogenated and hardened with palmolein. It is high on trans fats, a risk factor for high cholesterol, heart attacks and strokes,” said nutritionist S Bhama.In 2018, the government said 47 major temples in Tamil Nadu run by the Hindu Religious and Charitable Endowments Department will get Food Safety and Standards Authority of India certification for ‘prasad’. Food safety officials say they check all temples. “We told temple officials and priests not to use inedible substance as offering,” he said."
thehindu.com,cities,Caution against sale of adulterated coconut oil,21-08-2019,https://www.thehindu.com/news/cities/kozhikode/caution-against-sale-of-adulterated-coconut-oil/article29212813.ece,"Food Safety authorities in the district have called for keeping an eye on adulterated coconut oil, which is being widely sold in the State ahead of the Onam season. The authorities on Tuesday seized 205 litres of banned brands of coconut oil kept at a house in Vengeri for being supplied to the shops in the district. Around 800 litres of coconut oil in sealed packets of several brands, that were suspected to be of poor quality, were also seized from there. The samples of these have been sent to the Regional Analytical Laboratory for quality check under the Food Safety and Quality Act. The stock, consisting of several new brands, were found from the house of a manufacturer, whose oil mill at Narikkuni was sealed by the authorities earlier for low quality products. If the seized products were found to be of low quality, action will be taken against the manufacturer under the Food Safety Act. The authorities had earlier issued a warning regarding the presence of banned brands of coconut oil in the market, based on the laboratory tests carried out in May, June and July 2019. Banned brands The Food Safety Assistant Commissioner had banned the sale of ‘Soorya’ and ‘Ayilyam’ brands by Tamil Nadu-based manufacturer ‘Balakumaran’ in July. ‘ Soubhagya’ and ‘Surabhi’, two other brands of the same manufacturer, were banned in the district earlier. The authoritiese had urged the Tamil Nadu government to cancel the licence of the manufacturer for sale of substandard products. Meanwhile, people have been asked to contact 18004251125 for complaints about poor quality of food products."
indianexpress.com,cities,"Pune: 22 children, headmistress rushed to hospital after eating mid-day meal",22-08-2019,https://indianexpress.com/article/cities/pune/pune-22-children-headmistress-rushed-to-hospital-after-eating-mid-day-meal-5925451/,"Twenty-two students of the Rhambhau Mhalgi trust-run school in Katraj and its headmistress were admitted to hospital with vomiting and loose motion after eating khichdi served as mid-day meal. The students, from Class VIII to X, and headmistress Sampada Kirkole were admitted to Bharati Hospital in Katraj. Dr Sanjay Lalwani, medical director at the hospital, said four children were admitted in the paediatric ward, one of whom was in ICU as the child suffered dehydration from severe vomiting. The rest were treated in the out patient department and were stable. They had vomiting and loose motion, and it seems a case of food poisoning, Dr Lalwani said. Kirkole said that the khichdi arrived at the school at 8.45 am. “Around 9 am, I had some of it to ensure it was okay and the food was served around 9.30 am. Soon after, I was told that two children had vomited. I was on the third floor and rushed down, only to find more children taking ill. Even I fell sick. The trustee of the school immediately decided to send the children to Bharati hospital,” she said. Story continues below this ad A Food and Drug Administration (FDA) team collected samples of the khichdi for testing, while issuing ‘stop work’ orders to the Rajmi Mahila Vividh Karyakari Sanstha Maryadit, which supplies mid-day meals to 9,600 students across 23 schools. Explained Need to strictly implement laws The issue of children being served poor quality meals in schools has time and again been raised with little effect. Agencies supplying the meals have to meet deadlines which may affect quality of food. Chances of contamination are high when there is no check on how the food is prepared. In this case, the FDA team found flies and food prepared in unhygienic surroundings. Activists claim that at times these incidents were an outcome of the massive gap between resources provided by the government and quality of work. However, with lives of children at stake, there is a need to strictly implement the Food Safety and Standards Act to protect and promote public health. Sanjay Shinde, Assistant Commissioner, FDA (Pune), who visited the sanstha’s main kitchen at Anant Teerth Cooperative Housing Society in Kondhwa, said the 2,000 sqft place didn’t have packed windows due to which there were several flies inside. The agency has a licence to operate but there was no qualified (diploma or degree holder) expert to supervise the work. Food safety officer Ramakant Kulkarni also found the place dirty. “We have issued ‘stop work’ orders till they meet hygiene and cleanliness standards,” Shinde said. Assistant inspector Shrishail S Chiwadshetty of Bharti Vidyapeeth police station said, “Samples of the food have been collected by FDA officials. Based on the findings, there will be a probe into possible negligence on the part of the entity running the kitchen and also the school. If the probe reveals negligence, legal action may be initiated.” The Poshan Aahar Seva Sanghatana condemned the incident. “We demand strong legal action against PMC officials and employees responsible for awarding contracts to organisations that do not have either the capacity or capability to prepare these meals of required standards,” said Sham Sasane, president of the district unit of the sanghatana. Story continues below this ad Kiran Moghe, secretary, said that such incidents were happening regularly in Maharashtra and across the country. The central kitchen system proposed by the government is unable to provide food as per norms of the mid-day meal scheme, he added. “We hope this incident will force the government to reconsider its decision.” “Despite the fact that women Self Help Groups (SHGs) have consistently and diligently provided mid-day meals to schools for the last several years, certain employees and officials in the PMC have colluded to take away their work and awarded it to large contractors,” it said in a statement, adding that conditions set by the government and the PMC (Rs 40 lakh turnover, Rs 15 lakh deposit and 2,000 sqft area) have kept SHGs out of the process. “The PMC should cancel these contracts and blacklist these organisations before more harm is done to children. We demand that the work should once again be awarded to SHGs, the statement added."
thehindu.com,national,10 arrested for adulterating diesel and petrol in Meerut,23-08-2019,https://www.thehindu.com/news/national/other-states/10-arrested-for-adulterating-diesel-and-petrol-in-meerut/article29226050.ece,"Ten people have been arrested by the Uttar Pradesh police in connection with the running of an organised inter-State racket of supplying chemicals to adulterate petrol and diesel. According to the police, 2,000 litres of ‘fake’ petrol and 2 lakh litres of chemicals used for adulteration have been recovered from the premises of thinner and solvent factories and godowns in the Partapur area of Meerut where the accused were allegedly carrying out the criminal activity. A truck that was being used to supply the ‘fake’ petrol to at least 10 different petrol pumps in the city has also been seized. Alok Singh, I-G Police (Meerut Range), had asked the Crime Branch and local police to look into complaints of farmers about the engines of their tractors and tube well machines getting seized after buying diesel from certain petrol pumps in the city. “On the basis of clues provided by an informer, we conducted raids at Paras Chemical Factory and Ganpati Petrochem and recovered hundreds of litres of chemicals and spurious petrol and diesel on Tuesday night,” said Avinash Pandey, SP (Rural) Meerut. Proprietors booked The police arrested Rajiv Jain, proprietor, Paras Chemicals, and Pradeep Gupta, who owns Ganesh Petrochem, and eight others under Sections 420 of IPC and 3/7 of the Essential Commodities Act 1955. During interrogation, the accused revealed the modus operandi. “The two kingpins had licence to make thinner in their factories. They would add colour that is commonly used in making savouries to the chemical to ‘create’ the spurious fuel,” the police said. It allegedly cost them ₹38 a litre. They would supply it to petrol pumps in the city and neighbouring States in their truck. “We asked them to show the process in police presence and they said if 20% of it is added to original petrol, it is hard to detect its presence by a common consumer,” Mr. Pandey added. The police have informed the Indian Oil Corporation to take action against the colluding petrol pumps and three petrol pumps were raided on Thursday by officials of the district supply office."
thehindu.com,cities,Gutkha manufacturing unit unearthed in Prakasam,24-08-2019,https://www.thehindu.com/news/cities/Vijayawada/gutkha-manufacturing-unit-unearthed-in-prakasam/article29237060.ece,"In a major haul, police in coordination with Revenue and Food Safety department officials seized banned gutkha and chemicals worth ₹3 crore from a tobacco godown at Medarametla in Prakasam district on Friday. Superintendent of Police Siddharth Kaushal, who coordinated the joint operation by Darsi police and the Revenue and Food Safety departments, told the media after closing down the illegal gutkha manufacturing unit that ‘this is the biggest seizure in the State during the year’. The seized products included 265 gunny bags of tobacco powder that could be converted into about 15 lakh gutkha packets, ammonium chloride, lime powder and machinery, he said. The raid followed a tip-off about a gutkha manufacturing unit, from where the banned product was being distributed across the State in the names of two firms based in Delhi and Bengaluru, he said. Special teams were formed to nab all those involved in the racket, he said.The owner of the building, P. Hanumantha Rao, who had rented it out to one B. Prasad from Kovur in neighbouring PSRP Nellore district, was picked up for questioning. “We are on the lookout for Prasad, whose arrest is expected to throw more light on the enormity of the network,” he added. The SP patted the police personnel from Darsi division led by its DSP K. Prakasa Rao and Special Branch DSP V.S. Ram Babu for unearthing the illicit gutkha unit."
indiatimes.com,city,500 kg of paan masala seized from Gujarat Mail in Mumbai,22-08-2019,https://timesofindia.indiatimes.com/city/mumbai/500-kg-of-paan-masala-seized-from-gujarat-mail-in-mumbai/articleshow/70789015.cms,"Representative image. MUMBAI: More than 500 kg of paan masala was found unclaimed in a coach of the Gujarat Mail at Mumbai Central Terminus on Wednesday. The value of the consignment is nearly Rs 15 lakh. The Mumbai Central GRP is investigating about the person who sent the banned consignment. An FIR has been registered under provisions of the Food Safety and Standards Act , 2006.The Gujarat Mail left from Ahmedabad on Tuesday night and reached Mumbai Central Terminus on Wednesday morning.Parcels were offloaded from the SLR coach of the train. All parcels except 11 sacks were claimed. The parcel staff and Railway Protection Force found it suspicious that the sacks were emitting a strong odour. The sacks were seized and opened. Around 540 kg of paan masala was found. The GRP was then intimated for further action.""No arrest has been made so far. We will start checking CCTV footage of stations right from Ahmedabad,"" said a police officer."
indiatimes.com,city,Zirakpur man dies of jaundice after having unfit drinking water,24-08-2019,https://timesofindia.indiatimes.com/city/chandigarh/zirakpur-man-dies-of-jaundice-after-having-unfit-drinking-water/articleshow/70811546.cms,"Image used for representational purpose 10 fell ill last month Raids on fruit sellers 9 schoolkids test positive for jaundice in Patiala village MOHALI: Dirty water claimed the life of a 30-year-old Zirakpur man on Friday. The medical report of Sukhvinder Singh of Bhabat village, who was undergoing treatment at GMCH-32, says he died of jaundice after consuming contaminated drinking water.Blaming the Zirakpur municipal council, Sukhvinder’s father Gurmail Singh and brother Gurdeep Singh said the civic body did not repair a breach in portable water pipeline despite several complaints.“Besides us, the villagers had also approached the MC with the complaint, but all pleas went unheeded,” said Gurmail. Gurdeep said, “Sukhvinder fell ill after consuming water and thereafter contracted jaundice. He had been admitted to GMCH-32 for the past two weeks. The doctors said he contracted jaundice after consuming contaminated water.”Charan Singh, a resident of Bhabat village, said they have been complaining about milky water emitting foul smell, but the authorities concerned care less. “For the past few months, many people are falling sick. In June this year, there was a diarrhoea outbreak in our village after which many residents were admitted to hospitals. The roads are also in bad shape with water stagnant in potholes, which have become a breeding ground for dengue mosquitoes. No action has ever been taken. It seems the civic body is waiting for a bigger tragedy.”Municipal council executive engineer Sukhjinder Singh Sidhu said, “We will get the area scanned and water samples tested. As far as repairing the pipelines is concerned, the agenda has been sent for approval to the government, after which the work will start.”On July 23, 10 people took ill in Bhabat village in suspected cases of diarrhoea. All the affected were admitted to PGIMER and GMCH-32. The cause of diarrhoea was supply of contaminated potable water from a tubewell in the village.On June 20, teams of food safety wing and Zirakpur civic body had jointly conducted raids on fruit sellers in Zirakpur and found them using sewerage water to wash the produce. The teams seized 70kg of peaches and destroyed them. They also issued challan to a seller and warned him. Two peaches were sealed for sending to a laboratory for testing.Nine students, six boys and three girls, of a government school in Ulana village of Ghanaur block in Patiala district have been diagnosed with jaundice. The matter was brought to light by ASHA workers, who were visiting the premises to create awareness about various health schemes."
newindianexpress.com,nation,Mid-day meal 'cooked in animal fat' served to school students in Madhya Pradesh,24-08-2019,http://www.newindianexpress.com/nation/2019/aug/24/mid-day-meal-cooked-in-animal-fat-served-to-school-students-in-madhya-pradesh-2023387.html,"“Primarily it had come to our notice that adulterated food was being served by the SHG as MDM in the school, after which the food department team has seized MDM and other samples, which have been sent to Bhopal for lab testing. Till the time the findings of lab testing are known, the concerned SHG has been removed from the task for preparing MDM and alternative arrangements for MDM are being made. If the lab test deliver adverse report, action will be initiated against the concerned SHG as per the provisions of the Food Safety and Standards Act,” Khandwa district panchayat chief executive officer Roshan Singh said on Friday."
thehindu.com,cities,"FSSAI seizes 1,500 litres of edible oil on suspicion of adulteration",27-08-2019,https://www.thehindu.com/news/cities/Coimbatore/fssai-seizes-1500-litres-of-edible-oil-on-suspicion-of-adulteration/article29263246.ece,"Officials of the Food Safety and Standards Authority of India (FSSAI) seized nearly 1,500 litres of unlabelled cooking oil from a warehouse near Annur in Coimbatore, on suspicion of adulteration. K. Tamilselvan, Designated Officer of FSSAI in Coimbatore, said that the oil tins were found stocked in a warehouse belonging to a resident of Kariyagoundanur near Annur. Food Safety officers conducted a surprise raid at the warehouse based on specific information on Monday afternoon and found that a father-son duo was selling groundnut oil, coconut oil and sunflower oil after adding refined palm olein. “We have lifted samples of the oils, which will be tested in a Government food laboratory. Further action will be taken based on the test results,” said Dr. Tamilselvan. According to the official, the duo bought edible oils such as groundnut oil, coconut oil and sunflower oil from wholesale markets and mixed ‘super olein’, a doubled refined olein made out of fractionation of the standard olein. “They were mixing super olein, which costs around ₹ 70 per litre, with groundnut oil and selling the same for price ranging from ₹ 240 to ₹280 per litre. They have been selling the oil in Annur, Mettupalayam, Sirumugai and Periyanaickenpalayam for the last four years. They had not obtained licence from FSSAI and the oil tins were unlabelled,” he added. The warehouse was sealed following the raid."
thehindu.com,national,3 months jail for supply of poor quality milk,28-08-2019,https://www.thehindu.com/news/national/andhra-pradesh/3-months-jail-for-supply-of-poor-quality-milk/article29272730.ece,"The Chief Metropolitan Magistrate Court on Tuesday awarded three months simple imprisonment to Sanjay Nakra, nominee of M/s. Parag Milk Foods Private Limited, Palamaner, Chittoor district, for selling substandard milk. In November, 2014, officials of the Food Safety Department conducted a raid on M/s. Surya Rajendra Sangam Distributors, located at K.T. Road, Vijayawada, and seized samples of ‘Go Doubled Toned Milk Tetrapack’, supplied by M/s. Parag Milk Foods Private Limited. Food Safety officer A. Srinivas Rao registered cases against the supplier as well as the seller on various charges. The officers have sent the samples to laboratory, which confirmed that the packaged milk was ‘unsafe’, said Assistant Food Controller N. Purnachandra Rao. Distributor acquitted The court also imposed ₹10,000 as fine and acquitted the distributor in the case."
