Source,Section,Title,Date,URL,Text
thehindu.com,cover-story,Feeding lessons to tackle malnutrition,23-10-2019,https://frontline.thehindu.com/cover-story/article29766390.ece,"T he release of the Comprehensive National Nutrition Survey (CNNS 2016-2018) has renewed interest in tackling malnutrition in India. The conceptual framework for child undernutrition, developed by UNICEF, recognises breastfeeding, good complementary feeding, caring and health care to minimise disease burden as immediate underlying factors that determine malnutrition in all its forms. According to the CNNS, 35 per cent of the children under five were stunted (HAZ <-2 SD), 17 per cent were wasted (WHZ <-2 SD), and 33 per cent were underweight (WAZ <-2 SD). India has set ambitious targets to annually reduce stunting to 25 per cent by 2022. In the past decade the focus of dealing with malnutrition has been tilting in favour of treating severe malnutrition with ready-to-use therapeutic foods (RUTF), projected as a magic solution for saving babies. However, a recent study from eastern India concluded: “Given that the risk of mortality is lower than expected among children older than 6 months and that many deaths occur because of prematurity or low birth weight during the neonatal period, outpatient treatment for SAM [severe acute malnutrition] using RUTF for children over 6 months may be too late to avert a substantial number of deaths from undernutrition in Indian children. This further strengthens the case for prioritising prevention through known health, nutrition, and multisectoral interventions in the first 1,000 days of life.” Nutrition action in India needs a rethink and reassessment. Some fundamental corrections are needed to change the focus from treatment to prevention. One key approach is to ensure optimal feeding practices during the first 24 months of life. These are critical to a child’s survival, health, nutrition and development, not because children are vulnerable at this age but because their brains develop almost entirely in the first two years. The practices include initiating breastfeeding within an hour of birth and skin-to-skin contact with the mother immediately after birth, exclusive breastfeeding for the first six months, and continued breastfeeding along with adequate complementary feeding thereafter until two years or beyond. Fundamental corrections are suggested in policy and programme to ensure optimal practices more on how to do rather than what to do, given that the Government of India is seized of the matter in principle. The proposed corrections are also based on our findings and analysis of the hospital practices in relation to breastfeeding. If we made these corrections, they are likely to bring a shift towards preventive health care much needed by every child of new India, and rapidly reduce malnutrition. Why focus on optimal feeding practices? According to the World Health Organisation (WHO), non-exclusive breastfeeding and inadequate complementary feeding contribute to stunting and are among the important causes of wasting. An international study on the cost of not breastfeeding estimates that in India, inadequate breastfeeding results in 1,00,000 preventable child deaths (mainly due to diarrhoea and pneumonia), 34.7 million cases of diarrhoea, 2.4 million cases of pneumonia, and 40,382 cases of obesity. The health impact on mothers translates into more than 7,000 cases of breast cancer, 1,700 of ovarian cancer and 87,000 of type 2 diabetes. India spends Rs.727.18 crore on health care to battle illness. Optimal feeding has the potential to simultaneously reduce the risk or burden of both undernutrition and excess weight, obesity or diet-related non-communicable diseases (NCDs), including type 2 diabetes, cardiovascular diseases and some cancers. Improving breastfeeding rates has been explicitly stated to contribute to attainment of Sustainable Development Goals (SDGs) 2030 of health, nutrition, education, poverty, reducing inequalities, and inclusive economic growth. India is committed to SDGs. The Union Ministry of Health and Family Welfare launched the “Breastfeeding and IYCF Report Card” in August 2019, which counts on these three feeding practices. The report card is based on the National Family Health Survey (NFHS-4). Table 1 shows how India performs on the coverage of three indicators stipulated under NFHS and CNNS. Infant feeding practices are “inadequate” despite an overwhelming evidence of its impact on human health. It leaves more than one crore infants out of the safety net every year right during their first few months of life. These are the ones who slip into various degrees of malnutrition. Several factors contribute to inadequate infant feeding practices. Inadequate attention to policy and programmes for removing barriers to optimal feeding practices; inadequate planning and budget allocation; poor support to women in public and private health facilities; continued aggressive promotion of commercial baby foods; and inadequate structural support to women in both formal and informal workplaces are some of them. India made some headway in addressing the problem in the past decade, but the implementation of existing policies should be strengthened and programmatic interventions should be scaled up. In 2018, the World Breastfeeding Trends Initiative (WBTi), which assesses the state of policies and programmes in over 100 countries, launched its fifth report for India. It showed persistently weak attention to crucial policy and programme areas. Figure 1 shows how India fares on all the 10 indicators of policy and programmes out of a score of 10. The colour coding is based on scores, green, blue, yellow and red in descending order of performance. India is way behind, at number 78 out of 97 countries. A major correction is needed. Reaching all children and pregnant and lactating women with services they need to succeed is imperative. Protect, promote and support optimal feeding There are policy and programme areas that need to be examined and attended to. A critical area is the commercial influence of baby food companies on women and families. For over four decades, the World Health Assembly has recognised that commercial marketing of baby foods is a health hazard for infants. In India, the Infant Milk Substitutes Feeding Bottles, and Infant Foods (Regulation of Production, Supply and Distribution) Act, 1992, amended in 2003, bans the promotion of baby food for children under the age of two. Even after 27 years of this legal protection, the enforcement of this law is weak. Big food companies continue to illegally sponsor research and meetings of health workers, thereby influencing their behaviour towards use of infant formula for babies. No wonder that formula feeding is rampant at the time of birth. Babies born by caesarean section usually get formula at birth, instead of having their mothers receive support for breastfeeding. The government’s key agencies such as the Food Safety and Standards Authority of India (FSSAI) continue to partner with such companies and provide legitimacy. State governments have been found to rely on programmes sponsored by baby food companies. Our recent findings from hospitals revealed very weak awareness of the IMS Act. The task of implementing the IMS Act should be decentralised at the district level by authorising officers, funds should be allocated for making people aware, and compliance with the Act should be monitored. Government departments and agencies should keep baby food manufacturers and their allies at arm’s length. A critical policy intervention would be to ensure structural support for lactating mothers in order to enable them to combine breastfeeding and work. In 2017, India revised the Maternity Benefit Act of 1961 to provide 26 weeks of maternity leave and breastfeeding breaks. This Act extends to workers of mines, tea plantations, shops and establishments, as per a clarification issued by the Ministry. However, more than 90 per cent of women work in the unorganised sector. The Pradhan Mantri Matritva Vandana Yojana (PMMVY) provides a cash compensation of Rs.5,000 to women for the firstborn child. The scheme should be made universal under the provisions of the National Food Security Act, 2013. The IMS Act mandates reaching out to all pregnant and lactating women with accurate and unbiased information. While information campaigns are there, especially during specified months, face-to-face skilled counselling for each pregnant and lactating woman is the missing piece, as confirmed by recent findings from hospitals. Counselling means helping a mother decide on the best way of feeding her infant instead of just telling her to breastfeed. Counselling helps women build their confidence in their own milk supply. The WHO in 2018 provided guidelines for counselling women on when to breastfeed, how and with what frequency (Table 2) and recommended face-to-face counselling. Antenatal counselling on breastfeeding seems to be rare. The health care system should initiate breastfeeding within an hour of birth and support women to provide skin-to-skin contact with their babies. Exclusive breastfeeding requires multi-sectoral support spread over health, women and child development, labour, disaster management, HIV monitoring and information and broadcasting. While babies are still in hospitals after birth, mothers need skilled support to maintain exclusive breastfeeding. While the government has recognised the need of lactation support in the hospitals, new recruitments are not encouraged. A dedicated skilled lactation counsellor in a hospital can certainly make a huge difference to early breastfeeding rates and also control the use of unnecessary infant formula. Outreach counselling for the quality of complementary feeding is critical after an infant is six months old. According to the CNNS report, timely complementary feeding was initiated for 53 per cent of infants aged six to eight months; only 21 per cent were fed an adequately diverse diet; and 6 per cent received a minimum acceptable diet (which includes both frequency and diversity). This raises a serious question on how we deal with this situation. It is important to monitor how children are fed and how they grow. Dietary assessment for an individual child should be institutionalised. If the child is not getting four or more food groups in the diet, counselling is required and the diet must be compensated in poor households. Monitoring a child’s growth trajectory is another step. At least four nutrition and lactation counsellors should be recruited at the block level to play a mentoring role for community-level health workers such as ASHA, ANM and AWW and to conduct and supervise individual dietary assessments and growth monitoring of each child born in the block. The way forward India needs to ensure that these services reach every pregnant and lactating mother. The existing health system must be strengthened at the block level and in each health facility. Specially trained workers can turn the tide on malnutrition. Children should be fed diverse foods instead of being given dietary fortifications. Strengthening counselling services may cost about Rs.1 crore for every district annually. It is an expenditure that the Central and State governments should bear in the interest of building a new India and future brain power. A plan of action should be documented, with yearly actions and budgets, a coordinating mechanism, and a national scheme for protection and promotion of breastfeeding and complementary feeding. The WHO, UNICEF and World Bank recommend that an estimate of at least $4.7 (Rs.335) per newborn baby is required to achieve high rates of feeding indicators. India could do local estimates and fix a budget line in its health accounts. The answer may lie in a Prime Minister’s Stanpan Suraksha and Samvardhan Yojana (PMSSSY). Will it be helpful if India invests in promoting breastfeeding? The answer is yes. A comparison with Sri Lanka in the WBTi report card tells us why. Table 3 reflects on the 10 policies and programmes in which Sri Lanka scores high in almost all areas and maintains a high rate of exclusive breastfeeding. India scored a low 45 out of 100, whereas Sri Lanka scored 91. Sri Lanka scored green code in eight indicators and became the first country in the world to achieve a “green” colour code by the WBTi. This could well be one of the critical components of getting the health and nutrition indicators right in Sri Lanka. Dr Arun Gupta, a paediatrician with more than four decades of experience, and creator of the World Breastfeeding Trends Initiative (WBTi), coordinates the work of South Asia for International Baby Food Action Network (IBFAN). The 1998 Right Livelihood laureate, he is the central coordinator of Breastfeeding Promotion Network of India (BPNI) and convener of the Nutrition Advocacy in Public Interest (NAPi), a national think tank."
thehindu.com,cities,Officials discuss ways to curtail sale of edible oil in loose,31-10-2019,https://www.thehindu.com/news/cities/Madurai/officials-discuss-ways-to-curtail-sale-of-edible-oil-in-loose/article29835720.ece,"Officers of the Food Safety department across blocks in Madurai on Wednesday attended a meeting to discuss ways of curtailing sale of edible oil sold in loose in the district. Edible oil, which is not packaged, is prohibited for sale under the Food Safety and Standards (Prohibition and Restriction on Sales) Regulation, 2011. Designated Officer for Food Safety M. Somasundaram said there was steady mushrooming of shops flouting rules and selling oil in loose lately. “Usually, palm oil makes its way into the city and is sold under the name of sesame oil after using adulterants. The commodity is sold for cheap and is easy to procure,” he pointed out. The officer added that the sale of poor quality of edible oil would lead to several health implications, particularly heart-related ailments. “The sale of such products are targeted at those who are from socially backward classes. All unrefined palm oil is filled with trans fat and is bad for health,” Mr. Somasundaram said. The meeting with officers was intended at drawing up a list of shops in each of the blocks in Madurai selling oil in loose and for identifying spaces to store seized oil, the officer said. Dr. Somasundaram said that shopkeepers usually sold the oil under the pretext of helping the environment. “We often hear them saying that they avoid the use of plastic by pouring oil into containers that their customers bring. This is a farce.” The food safety officer added that the department had already launched an exercise in curtailing sale of loose oil."
indiatimes.com,city,Crackdown soon on loose sale of cooking oil,31-10-2019,https://timesofindia.indiatimes.com/city/madurai/crackdown-soon-on-loose-sale-of-cooking-oil/articleshow/71828095.cms,"Representative image Food safety officials are planning to crack down on the loose sale of cooking oil which has been banned by the food safety and standards authority of India since August 2011. A large number of shops in Madurai city and rural areas sell adulterated groundnut and gingelly oil in loose, which is used for cooking purpose.Although adulteration of the oil sold in loose is rampant, food safety officials find it difficult to crack the whip on its perpetrators due to the legal impediments in proving that the oil sold is meant for cooking purpose.Officials say it would be easier for them to ensure fair manufacturing and trade practices once the practice is stopped. Designated officer for food safety in the district, Dr M Somasundaram, said, “Essence is mixed with palm oil to sell it as groundnut and gingelly oil. Selling palm oil is legal but not the practice of selling it as other oil varieties. The practice is rampant in loose oil sales. I have briefed food safety officers in the district at a meeting today on how to go about it. Oil kept in vessels for sales will be seized.”He said that the rule applies for cold pressed oils too. While its makers have a manufacturer licence, the only thing they have to do is sell them in sealed packets and containers with all the details as per packing rules. Somasundaram said in this regard higher authorities in the food safety department had conveyed a strong message to the oil manufacturers and traders at the third state-level oil committee meeting in Chennai recently. Many traders offered the lame excuse that they indirectly helped the environment by avoiding plastic by selling loose oil and hence should be allowed to carry on in the traditional way. However, the department found that not many customers carried containers while buying oil and ended up packing it in banned plastics only, he said.There was a time when traders used to sell only unadulterated food items, but ethics are not followed at present. They estimate that almost half the quantity of oil sold in Madurai is in loose. A list of traders who sell loose oil has been prepared from the information obtained from wholesalers. They will initiate action once the place required to store the seized oil is readied, said Somasundaram. He also said that action against loose oil does not mean that all packed oil varieties are safe and free of adulteration. The intention is to streamline the trade so that it will be easier to ensure quality and check if there is a complaint by a customer, the officials said."
indiatimes.com,city,"Banned tobacco products worth Rs 5,80,000 seized in Mumbai",05-11-2019,https://timesofindia.indiatimes.com/city/mumbai/banned-tobacco-products-worth-rs-580000-seized-in-mumbai/articleshow/71920466.cms,"The city crime branch on Monday along with the Food Drugs and administrative (FDA) raided at two places at 5th road, Khar West and seized banned gutka worth Rs 5,80,000 and a Maruti van. MUMBAI: The city crime branch on Monday along with the Food Drugs and Administrative (FDA) raided at two places at 5th road, Khar West and seized banned gutka worth Rs 5,80,000 and a Maruti van .Crime branch unit 10 have arrested the godown owner Abu Sahama Riyaz Ahmad khan,30, a resident of Shivsai apartment, Nalasopara, East.Police have booked him under various sections of Food safety and standard act 2006, Regulations of Food safety and standards (Prohibition and Restrictions on sales) Regulations 2011 and Regulations of Food safety and standards (Food products standards and food additives) Regulations 2011."
thehindu.com,cities,Coimbatore continues to get banned tobacco products for sale,04-11-2019,https://www.thehindu.com/news/cities/Coimbatore/coimbatore-continues-to-get-banned-tobacco-products-for-sale/article29873204.ece,"Enforcement activities are yet to deter the sale of banned tobacco products in Coimbatore as the contraband is being sold even near educational institutions. On Saturday, officials of the Food Safety and Standards Authority of India (FSSAI) checked two shops near a school at Irugur and seized around three kg of banned tobacco products of different brands. Police also say that there were several incidents wherein they seized sachets of banned tobacco products from shops close to educational institutions in the city too. The law prohibits the sale of any tobacco products within a radius of 100 yards of any educational institution. In the case of Saturday’s seizure, the two shops were found with tobacco products like gutkha – manufacture, possession and sale of which is prohibited in Tamil Nadu like many other States. According to L. Balaji Saravanan, Deputy Commissioner of Police, Coimbatore City, police have been doing regular checks to prevent the sale of prohibited tobacco products. He said the city police had so far registered 1,250 cases this year under the provisions of the Cigarettes and Other Tobacco Products (Prohibition of Advertisement and Regulation of Trade and Commerce, Production, Supply and Distribution) Act (COTPA), 2003. Sources with Coimbatore District (Rural) Police said that nearly 1,000 cases were also registered in the rural limits for sale and possession of banned tobacco products. According to police, illegal manufacturing of banned tobacco products was contained in the district when they busted a panmasala unit at Kannampalayam near Sulur on April 28, 2018 and seized 648 kg of gutka in sachets apart from the raw materials. The panmasala unit owned by Amit Jain of New Delhi manufactured the banned products while he was given permits to manufacture only non-tobacco based products. “Banned tobacco products are now trafficked in private vehicles and inter-State buses. There had been incidents wherein workers from other States were used as carriers to transport banned tobacco products,” said a senior police officer. In May 2018, the FSSAI seized 840 kg of banned tobacco products worth around ₹ 6.44 lakh when the consignment was being trafficked from Bengaluru to Coimbatore in two mini goods carriers. In December 2017, FSSAI officials had seized prohibited tobacco products worth over ₹ 10 lakh from an omni bus operating from Bengaluru to Coimbatore. Recent seizures of banned tobacco products in large quantity by the FSSAI from warehouses in Coimbatore suggest that the supply of the contraband from other States is yet to be contained. K. Tamilselvan, Designated Officer of the FSSAI in Coimbatore, said that packets of gutka seized in recent raids had little whereabouts of the manufacturer. “The sachets seized in surprise raids did not have details of the manufacturer, date of manufacture or batch number. Hence, tracing the manufacturer or place of manufacture is a tough task,” he said. Dr. Tamilselvan added that discussions were also in progress to form a steering committee chaired by the District Collector and officials from various departments, including the police, to enforce prohibition of banned tobacco products in Coimbatore. With some of the offenders getting repeatedly booked for stocking banned tobacco products, the FSSAI plans to request the Collector to invoke provisions of the Goondas Act against such persons."
thehindu.com,national,Contaminated rice stock seized,07-11-2019,https://www.thehindu.com/news/national/kerala/contaminated-rice-stock-seized/article29912698.ece,"The food safety authorities here on Thursday seized 81 sacks of rice on suspicion of chemical contamination. Unnikrishnan Nair P., Assistant Commissioner of Food Safety, said the sacks were seized following reports that five workers who had been unloading the stock at a shop in Peroor developed uneasiness and were hospitalised. During an inspection, the workers also recovered a few empty packets of aluminium phosphide along with the rice sacks. “The rice stock was being transported from a godown at Ettumanoor and preliminary probe suggests that the chemical, a highly toxic one often used as a fumigant in godowns, somehow got into it. Samples have been collected and sent to the government analytical lab in the capital,” the official said. Meanwhile, the authorities also inspected the godown where the stock had been kept and collected evidence. Further course of action will be decided upon receiving the sample analysis report. Besides the food safety department, the police too have launched a probe into the episode."
newindianexpress.com,states,30 tonnes of rice seized; dealer found using deadly pesticide,08-11-2019,https://www.newindianexpress.com/states/kerala/2019/nov/08/30-tonnes-of-rice-seized-dealer-found-using-deadly-pesticide-2058648.html,"The malpractice came to light after a few head-load workers in a retail shop of the dealer in Ettumanoor, who were unloading the rice sacks brought from an Athirampuzha godown, also owned by the dealer, developed uneasiness and were hospitalised. In an inspection by other workers, a few empty packets of aluminium phosphide were found along with the rice sacks."
thehindu.com,cities,Banned tobacco products seized,10-11-2019,https://www.thehindu.com/news/cities/Coimbatore/banned-tobacco-products-seized/article29933529.ece,"Officials from the Food Safety and Standards Authority of India (FSSAI) seized banned tobacco products weighing 350 kg worth ₹3 lakh from a private godown at Kangayam, Tiruppur district, on Saturday. The team, led by B. Vijayalalithambigai, Designated Officer of FSSAI (Tiruppur), sealed the godown and took samples of the products for laboratory tests. Food safety officials also seized one tonne of single-use plastic covers and handed them to the Kangayam Municipality."
